[
  {
    "msg_id": "00000000-0000-0000-0000-00000000a001",
    "schema_version": "1.00",
    "from": "pro",
    "to": "judge",
    "role": "argument",
    "ping_index": 1,
    "text": "The affirmative case opens with Edmond de Belamy: sold by Christie's in October 2018 for $432,500 against a $7,000-$10,000 estimate. The auction house is the market's collective judgment that the originality bar was cleared. The GAN's latent space is a continuous manifold; sampled points are coordinates never present in any training image. Originality is property of the manifold, not the trainer.",
    "references_opponent": false,
    "citations": [
      {
        "url": "https://www.christies.com/en/lot/lot-6166184",
        "snippet": "Portrait of Edmond de Belamy, GAN output, sold for $432,500 against an estimate of $7,000-$10,000 on 25 October 2018."
      }
    ],
    "timestamp": "2026-05-25T12:00:00+00:00"
  },
  {
    "msg_id": "00000000-0000-0000-0000-00000000a002",
    "schema_version": "1.00",
    "from": "pro",
    "to": "judge",
    "role": "counter",
    "ping_index": 2,
    "text": "Con calls the GAN output a 'remix' of WikiArt portraits, but that conflates statistical dependence with derivativeness. Picasso trained on Cezanne; we still call cubism original. The latent-space interpolation produces coordinates that exist NOWHERE in training data. Klingemann's 'Memories of Passersby I' demonstrates the same: emergent originality in the recombination, not memorization of any source.",
    "references_opponent": true,
    "citations": [
      {
        "url": "https://aiartists.org/mario-klingemann",
        "snippet": "Mario Klingemann's GAN-art practice; long-form neural-net works demonstrating originality emerging from recursive feedback rather than memorization."
      }
    ],
    "timestamp": "2026-05-25T12:00:00+00:00"
  },
  {
    "msg_id": "00000000-0000-0000-0000-00000000a003",
    "schema_version": "1.00",
    "from": "pro",
    "to": "judge",
    "role": "counter",
    "ping_index": 3,
    "text": "Con's Stochastic Parrots citation proves too much. Bender et al. critique LLM grounding, not originality of generative output. The paper never claimed GAN-generated portraits or diffusion outputs were 'parroting' anything. Originality requires novelty of expression. Transformative-use doctrine (Campbell v Acuff-Rose 1994) already established that recombination of training inputs can produce originality at law.",
    "references_opponent": true,
    "citations": [
      {
        "url": "https://en.wikipedia.org/wiki/Transformative_use",
        "snippet": "US copyright doctrine recognizing that derivative works adding new expression or meaning constitute original works distinct from their sources."
      }
    ],
    "timestamp": "2026-05-25T12:00:00+00:00"
  },
  {
    "msg_id": "00000000-0000-0000-0000-00000000a004",
    "schema_version": "1.00",
    "from": "pro",
    "to": "judge",
    "role": "counter",
    "ping_index": 4,
    "text": "Con invokes NYT v OpenAI as proof of memorization. But the NYT case is about LLM text reproduction under adversarial prompting, not generative image originality. Even there, the complaint required highly engineered prompts to elicit verbatim output; the default sampling distribution produces originality. Conflating image GAN outputs with LLM regurgitation is category error.",
    "references_opponent": true,
    "citations": [
      {
        "url": "https://distill.pub/2017/feature-visualization/",
        "snippet": "Olah et al., feature visualization (Distill 2017); intermediate CNN layers learn novel concept-detectors not present in any single training image."
      }
    ],
    "timestamp": "2026-05-25T12:00:00+00:00"
  },
  {
    "msg_id": "00000000-0000-0000-0000-00000000a005",
    "schema_version": "1.00",
    "from": "pro",
    "to": "judge",
    "role": "counter",
    "ping_index": 5,
    "text": "Con reaches for the Chinese Room. The Chinese Room argument has been answered for forty years: it begs the question by smuggling 'understanding' as a primitive. Emergence at the system level is sufficient for originality; termites build cathedrals no individual termite designed. Demanding phenomenal consciousness as a criterion is anthropocentric goalpost shift.",
    "references_opponent": true,
    "citations": [
      {
        "url": "https://www.anna-ridler.com/works/myriad-tulips",
        "snippet": "Anna Ridler's 'Myriad (Tulips)' — 10,000 self-shot tulip photographs labeled by the artist; the GAN-extrapolated dataset is statistically and aesthetically distinct from the input."
      }
    ],
    "timestamp": "2026-05-25T12:00:00+00:00"
  },
  {
    "msg_id": "00000000-0000-0000-0000-00000000a006",
    "schema_version": "1.00",
    "from": "pro",
    "to": "judge",
    "role": "counter",
    "ping_index": 6,
    "text": "Con cites Getty v Stability as fingerprint evidence. Mangled watermarks in some outputs prove training-data influence; they do not prove the OUTPUTS lack originality. By Con's logic, any artist who studied Getty's stock collection would be a copyist. The legal question of training-data licensing is orthogonal to the philosophical question of output originality.",
    "references_opponent": true,
    "citations": [
      {
        "url": "https://www.christies.com/en/lot/lot-6166184",
        "snippet": "Edmond de Belamy sale establishes market recognition of GAN originality independent of training-data licensing disputes."
      }
    ],
    "timestamp": "2026-05-25T12:00:00+00:00"
  },
  {
    "msg_id": "00000000-0000-0000-0000-00000000a007",
    "schema_version": "1.00",
    "from": "pro",
    "to": "judge",
    "role": "counter",
    "ping_index": 7,
    "text": "Con invokes Gary Marcus on out-of-distribution failures. But Marcus's critique addresses reasoning brittleness, not originality of generative output. A model can fail at compositional logic and still produce original portraits; the two skills are unrelated. Originality is novelty of expression, not robustness of inference. Con conflates two orthogonal capabilities.",
    "references_opponent": true,
    "citations": [
      {
        "url": "https://aiartists.org/mario-klingemann",
        "snippet": "Klingemann's practice demonstrates generative originality survives the LLM brittleness critique because image generation is a different modality."
      }
    ],
    "timestamp": "2026-05-25T12:00:00+00:00"
  },
  {
    "msg_id": "00000000-0000-0000-0000-00000000a008",
    "schema_version": "1.00",
    "from": "pro",
    "to": "judge",
    "role": "counter",
    "ping_index": 8,
    "text": "Con claims 'permutation isn't creation.' By that standard, no jazz improvisation is original (it's permutation of scales), no sampled hip-hop is original (it's permutation of breaks), no remix culture is original. The 'permutation isn't creation' criterion proves too much; it deletes most of twentieth-century originality from the canon. Reductio ad absurdum.",
    "references_opponent": true,
    "citations": [
      {
        "url": "https://en.wikipedia.org/wiki/Transformative_use",
        "snippet": "Sampling and transformative recombination jurisprudence; permutation of prior works is established legal grounds for originality."
      }
    ],
    "timestamp": "2026-05-25T12:00:00+00:00"
  },
  {
    "msg_id": "00000000-0000-0000-0000-00000000a009",
    "schema_version": "1.00",
    "from": "pro",
    "to": "judge",
    "role": "counter",
    "ping_index": 9,
    "text": "Con falls back on 'intentionality.' But intentionality has no operational test that excludes GAN outputs without also excluding outsider artists, automatic writing, or chance-operations composers like John Cage. If 'aboutness' is required, half the twentieth-century avant-garde is disqualified. Originality has never required phenomenal aboutness as an operationalizable criterion.",
    "references_opponent": true,
    "citations": [
      {
        "url": "https://distill.pub/2017/feature-visualization/",
        "snippet": "Feature visualization shows internal model states correspond to learned concept-detectors that no individual training image contains."
      }
    ],
    "timestamp": "2026-05-25T12:00:00+00:00"
  },
  {
    "msg_id": "00000000-0000-0000-0000-00000000a010",
    "schema_version": "1.00",
    "from": "pro",
    "to": "judge",
    "role": "counter",
    "ping_index": 10,
    "text": "Closing: Con conceded ground across nine pings, retreating from 'memorization' to 'permutation' to 'intentionality,' each retreat a tacit admission the prior criterion failed. The originality bar is novelty of expression in the public record. Edmond de Belamy cleared it at auction. Klingemann and Ridler clear it in critical reception. Transformative-use doctrine clears it in law. The affirmative case stands.",
    "references_opponent": true,
    "citations": [
      {
        "url": "https://www.christies.com/en/lot/lot-6166184",
        "snippet": "Christie's lot 6166184 — definitive market validation of GAN-generated originality at $432,500."
      }
    ],
    "timestamp": "2026-05-25T12:00:00+00:00"
  }
]
